{
  "$schema": "http://json-schema.org/draft-07/schema#",
  "$id": "https://raw.githubusercontent.com/Remmyboy/sanctuary-mods/main/docs/mod.schema.json",
  "title": "Sanctuary mod manifest (mod.json)",
  "description": "Describes a mod folder under engine\\SanctuaryMods. See docs/writing-mods.md.",
  "type": "object",
  "required": ["id"],
  "properties": {
    "$schema": { "type": "string" },
    "id": {
      "description": "How the lobby names the mod to other players. Prefix it with your own name so it never collides with someone else's.",
      "type": "string",
      "pattern": "^[a-z0-9._-]{1,64}$"
    },
    "name": { "description": "Shown on the Mods page and in the lobby.", "type": "string" },
    "version": { "description": "Shown to players; the lobby compares contents, not this.", "type": "string" },
    "author": { "type": "string" },
    "description": { "description": "A sentence or two, shown on the Mods page.", "type": "string" },
    "kind": {
      "description": "ui: changes only your own screen, you switch it on and off. gameplay: changes the match; the lobby host picks it and every player needs an identical copy.",
      "enum": ["ui", "gameplay"]
    },
    "luaRoot": {
      "description": "The folder, inside the mod, that mirrors the game's LJ\\lua. Default \"lua\".",
      "type": "string",
      "default": "lua"
    },
    "url": { "description": "Where to get the mod. Shown to players who are missing it.", "type": "string" },
    "requires": {
      "description": "Ids of gameplay mods that must be picked alongside this one.",
      "type": "array",
      "items": { "type": "string", "pattern": "^[a-z0-9._-]{1,64}$" }
    },
    "apiVersion": { "description": "The Mod API major version the mod was written for.", "type": "integer", "default": 1 },
    "gameVersion": {
      "description": "The game version the mod was made and tested for (\"0.0.1.20\"), or a prefix of it (\"0.0.1\"). On any other version the Mods page says so; the mod still loads.",
      "type": "string"
    },
    "hostScript": {
      "description": "A Lua file of the mod's, relative to its lua folder (\"alice/norush/host.lua\"), imported in the host's simulation when the mod is picked. The place for match rules; see Import(\"modapi/events.lua\").Events.",
      "type": "string",
      "pattern": "\\.lua$"
    },
    "clientScript": {
      "description": "A Lua file of the mod's, relative to its lua folder, imported in every player's client (and replays) when the mod is picked. For what players see.",
      "type": "string",
      "pattern": "\\.lua$"
    },
    "options": {
      "description": "Settings the lobby host picks for a gameplay mod. Lua reads them with Import(\"modoptions/<id>.lua\").Options.",
      "type": "array",
      "maxItems": 32,
      "items": {
        "type": "object",
        "required": ["key", "type"],
        "properties": {
          "key": {
            "description": "The name Lua and C# read the value by. A Lua name: letters, digits and _, not starting with a digit, not a Lua keyword.",
            "type": "string",
            "pattern": "^[A-Za-z_][A-Za-z0-9_]{0,39}$"
          },
          "label": { "description": "Shown in the lobby. Default: the key.", "type": "string" },
          "description": { "description": "Shown on the Mods page.", "type": "string" },
          "type": {
            "description": "toggle: on or off. choice: one of a list. number: a number, optionally in a range and on a step. units: a set of units the host picks from the game's unit list.",
            "enum": ["toggle", "choice", "number", "int", "units"]
          },
          "default": {
            "description": "A toggle's true or false, a choice's value, a number, or a units option's unit ids. Missing: off, the first choice, the lowest number, or no units.",
            "type": ["boolean", "string", "number", "array"],
            "items": { "type": "string", "pattern": "^[a-z0-9_]{1,40}$" }
          },
          "choices": {
            "description": "For a choice: values, or { value, label } pairs.",
            "type": "array",
            "maxItems": 50,
            "items": {
              "anyOf": [
                { "type": "string" },
                {
                  "type": "object",
                  "required": ["value"],
                  "properties": { "value": { "type": "string" }, "label": { "type": "string" } },
                  "additionalProperties": false
                }
              ]
            }
          },
          "min": { "description": "For a number: the lowest value.", "type": "number" },
          "max": { "description": "For a number: the highest value. With min, the lobby shows a slider.", "type": "number" },
          "step": { "description": "For a number: values snap to min plus a whole number of steps.", "type": "number", "exclusiveMinimum": 0 }
        },
        "additionalProperties": false
      }
    },
    "ais": {
      "description": "Ignored since game 0.0.1.21, whose lobby picks AIs itself from LJ/lua/AI/mods. Kept so older mod.json files still validate.",
      "deprecated": true,
      "type": "array",
      "maxItems": 8,
      "items": {
        "type": "object",
        "properties": {
          "key": { "description": "The mod's own name for the AI. Default: made from the name.", "type": "string", "pattern": "^[a-z0-9_-]{1,32}$" },
          "name": { "description": "Shown in the seat's dropdown (\"AI: <name>\").", "type": "string", "maxLength": 40 },
          "folder": { "description": "The AI folder under the mod's lua folder, laid out like the game's AI/mods/AI-Sanctuary-Rush.", "type": "string", "examples": ["AI/mods/DuckAI"] },
          "description": { "description": "Shown on the Mods page.", "type": "string", "maxLength": 300 },
          "land": { "description": "May use the land layer. Default true.", "type": "boolean" },
          "air": { "description": "May use the air layer. Default true.", "type": "boolean" },
          "naval": { "description": "May use the water layer. Default false.", "type": "boolean" }
        },
        "additionalProperties": false
      }
    },
    "factions": {
      "description": "Factions the mod adds to the lobby's faction dropdown while the host has it picked. The Mod API numbers them after the game's three, in pick order, and writes them into FactionsData; no C# needed.",
      "type": "array",
      "maxItems": 8,
      "items": {
        "type": "object",
        "required": ["tag", "unitPrefix"],
        "properties": {
          "key": { "description": "The mod's own name for the faction. Default: the tag in small letters.", "type": "string", "pattern": "^[a-z0-9_-]{1,32}$" },
          "name": { "description": "Shown in the lobby, and FactionsData's name.", "type": "string", "maxLength": 32 },
          "tag": { "description": "The faction tag every unit of the faction carries in its tags list (Tags.DYCOM). Not EDA, CHOSEN or GUARD.", "type": "string", "pattern": "^[A-Z][A-Z0-9_]{0,31}$" },
          "unitPrefix": { "description": "The two letters the faction's unit ids start with (\"ud\"). Not ue, uc or ug.", "type": "string", "pattern": "^[a-z]{2}$" },
          "icon": { "description": "A PNG in the mod folder shown beside the name in the lobby (\"icons/dycom.png\"), 64x64 or so.", "type": "string", "pattern": "\\.[pP][nN][gG]$" },
          "looksLike": { "description": "Whose shields, build beams, factory platforms and adjacency effects the faction's units borrow.", "enum": ["EDA", "CHOSEN", "GUARD", "eda", "chosen", "guard"] },
          "commander": { "description": "The starting unit's template id, when the faction has one commander.", "type": "string" },
          "commanders": {
            "description": "Commanders to pick from, each its own entry in the dropdown (\"Dycom\", \"Dycom (Mech)\"). The first is the default.",
            "type": "array",
            "minItems": 1,
            "maxItems": 8,
            "items": {
              "anyOf": [
                { "type": "string" },
                {
                  "type": "object",
                  "required": ["unit"],
                  "properties": {
                    "name": { "description": "Shown in the dropdown after the faction's name.", "type": "string", "maxLength": 24 },
                    "unit": { "description": "The starting unit's template id.", "type": "string" }
                  },
                  "additionalProperties": false
                }
              ]
            }
          },
          "ai": {
            "description": "The AI the faction's AI armies play: a folder under the mod's lua folder laid out like AI/mods/AI-Sanctuary-Rush, or false/absent for the stock AI.",
            "anyOf": [
              { "type": "string" },
              { "type": "boolean", "const": false },
              {
                "type": "object",
                "required": ["folder"],
                "properties": {
                  "folder": { "description": "Under the lua folder: \"AI/mods/AI-Dycom\".", "type": "string" },
                  "land": { "description": "Let the AI use land units. Default true.", "type": "boolean" },
                  "air": { "description": "Let the AI use air units. Default true.", "type": "boolean" },
                  "naval": { "description": "Let the AI use naval units. Default false.", "type": "boolean" }
                },
                "additionalProperties": false
              }
            ]
          }
        },
        "additionalProperties": false
      }
    }
  },
  "additionalProperties": false
}
