{
  "$schema": "https://raw.githubusercontent.com/Remmyboy/sanctuary-mods/main/docs/mod.schema.json",
  "id": "sanctuarymods.balancepatch",
  "name": "Balance Patch",
  "version": "0.2.9",
  "author": "Sanctuary Mods",
  "description": "A rebalance designed from target match pacing: territory pays, the commander starts the game rather than carrying it, land costs alloys and air costs energy, T2 has to be paid for, engineers can be raided, and commanders' missiles and artillery hit moving targets. Air is left as the game has it, at the energy price. Fixes a bug where one broken bomber froze other units' targeting, and aircraft can no longer fire from inside a shield at what it covers. Each section can be turned off in the lobby.",
  "kind": "gameplay",
  "luaRoot": "lua",
  "gameVersion": "0.1.21.1",
  "apiVersion": 1,
  "options": [
    { "key": "fixes", "label": "Fixes", "type": "toggle", "default": true,
      "description": "Bugs: a bomber with no muzzles stopped other units' targeting; aircraft inside a shield's bubble hit everything under it; the Chosen T2 point defence couldn't raise its barrel above level; T1 bombs expired before they could land." },
    { "key": "economy", "label": "Economy", "type": "toggle", "default": true,
      "description": "Commanders make 3 alloys and 30 energy a second (were 5 and 50) and start you with full storage, 500 alloys and 5000 energy (was half, 250 and 2500). T2 and T3 extractors make 5 and 15 (were 4 and 10); T1 and T2 generators make 20 and 600 energy (were 10 and 300), and T3 ones cost 2800 alloys (were 5000). Alloy Furnaces use 2000 energy a second (were 1000). The Guardian Crucible costs 3x as much and takes 3x as long to build (150000 alloys), and its death explosion does 50000 damage out to 40. Factories cost 200 alloys (were 150), upgrading one to T2 costs 1000 (was 500) over 90 s (was 80) and to T3 4000 (was 2000), and T3 tanks and the Guardian T3 raider cost 30% less. T2 radar uses 250 energy a second (was 150) and T3 radar costs 2800 alloys (was 700) and 1400 energy a second (was 350); EDA and Chosen T3 radar see 750 and 850 (were 450 and 550). Wrecks reclaim 3x as fast and last 6 minutes (were 3). Land units cost 6 energy per alloy (were 10) and T1-T3 aircraft 40 (were 20, Chosen 10), and engineers have less than half their health." },
    { "key": "commanders", "label": "Commanders", "type": "toggle", "default": true,
      "description": "The EDA and Guardian commanders' missiles fly at once and steer at where the target is going, in smaller, faster volleys: they hit moving units as often as the Chosen commander does." },
    { "key": "artillery", "label": "Artillery", "type": "toggle", "default": true,
      "description": "Artillery leads moving targets (it couldn't hit anything moving in a straight line); the three factions' T1 artillery are brought level." },
    { "key": "defences", "label": "Defences", "type": "toggle", "default": true,
      "description": "Point defences see as far as they shoot, and T1 point defences are tougher: they beat their cost in T1 tanks, while T1 artillery still outranges them. T2 point defences are much tougher and hit harder, and the Chosen T3 one hits much harder. Shields cost more and hold less: T2 300 alloys for 6000 (were 150 for 10000), T3 1000 for 15000 (were 600 for 20000), and use twice the energy to run." },
    { "key": "units", "label": "Unit tuning", "type": "toggle", "default": true,
      "description": "The Chosen Jager toned down and the other T2 raiders brought up, so T2 beats its cost in T1 without crushing it; the three T1 tanks brought level; T3 tanks move as fast as T1 tanks with quicker guns, and the Guardian T3 raider is faster still and lighter; T4 bots move at 2.25-3 (were 2; none faster than T3 tanks; the Chosen big bot keeps the game's 1) and are game enders: 10000-25000 alloys with health and damage to match, less for the ones whose splash and range already win fights; the EDA railgun sniper reaches 80." }
  ]
}
