{
  "$schema": "https://raw.githubusercontent.com/Remmyboy/sanctuary-mods/main/docs/mod.schema.json",
  "id": "sanctuarymods.phantomx",
  "name": "Phantom-X",
  "version": "0.2.3",
  "author": "Sanctuary Mods (after Novaprim3, Duck_42, mead, SpikeyNoob and Fichom's Phantom-X for Forged Alliance)",
  "description": "Supreme Commander's Phantom-X. Everyone starts allied; a few minutes in, some players secretly become phantoms, fed a share of everyone else's income. Phantoms win by being the last one standing, innocents by killing every phantom. Paladins hunt them with a smaller bonus, which phantoms can pay to take away. Phantoms are revealed at set times. Break and offer alliances, mark paladins, vote and volunteer on the Phantom-X panel. Best with three or more players.",
  "kind": "gameplay",
  "luaRoot": "lua",
  "gameVersion": "0.0.1.20",
  "hostScript": "phantomx/host.lua",
  "clientScript": "phantomx/client.lua",
  "apiVersion": 1,
  "options": [
    { "key": "phantoms", "label": "Number of phantoms", "type": "choice", "default": "vote",
      "choices": [ { "value": "vote", "label": "Players vote" }, { "value": "1", "label": "1" }, { "value": "2", "label": "2" }, { "value": "3", "label": "3" } ],
      "description": "With a vote, nobody voting means a third of the players (rounded up). There's always at least one innocent." },
    { "key": "assignMinutes", "label": "Phantoms chosen at (minutes)", "type": "number", "default": 8, "min": 3, "max": 15, "step": 1,
      "description": "Until then everyone is allied and nobody has a role. The vote opens two minutes before, volunteering one minute before." },
    { "key": "picking", "label": "Picking phantoms", "type": "choice", "default": "volunteer",
      "choices": [ { "value": "random", "label": "At random" }, { "value": "volunteer", "label": "Volunteers more likely" }, { "value": "balance", "label": "Balance the teams" } ],
      "description": "Volunteers get six tickets in the draw to everyone else's one. Balancing (two phantoms only) picks the pair whose spending best matches the innocents'." },
    { "key": "bonus", "label": "Phantom bonus (%)", "type": "number", "default": 70, "min": 30, "max": 250, "step": 10,
      "description": "Scales every phantom and paladin bonus. At 100% one phantom gets 20-28% of the innocents' combined income, depending on how many innocents it's still allied with." },
    { "key": "paladins", "label": "Paladins per phantom", "type": "choice", "default": "1:2",
      "choices": [ { "value": "none", "label": "None" }, { "value": "1:1", "label": "1 per phantom" }, { "value": "1:2", "label": "1 per 2 phantoms" }, { "value": "1:3", "label": "1 per 3 phantoms" }, { "value": "2:3", "label": "2 per 3 phantoms" } ],
      "description": "Paladins are innocents with a share of the phantom bonus. Fractions round down." },
    { "key": "paladinBonus", "label": "Paladin bonus (% of a phantom's)", "type": "number", "default": 45, "min": 25, "max": 65, "step": 10 },
    { "key": "marks", "label": "Paladin marks", "type": "choice", "default": "perPhantom",
      "choices": [ { "value": "none", "label": "None" }, { "value": "perPaladin", "label": "1 per paladin" }, { "value": "perPhantom", "label": "1 per phantom" }, { "value": "twoPerPhantom", "label": "2 per phantom" }, { "value": "1", "label": "1" }, { "value": "2", "label": "2" }, { "value": "3", "label": "3" }, { "value": "4", "label": "4" } ],
      "description": "Shared out between the phantoms. A mark costs alloys, more as the match goes on, and stops a paladin's bonus." },
    { "key": "reveal1", "label": "First reveal (minutes, 0 = never)", "type": "number", "default": 30, "min": 0, "max": 60, "step": 1,
      "description": "Counted from when the phantoms are chosen." },
    { "key": "reveal2", "label": "Second reveal", "type": "choice", "default": "same",
      "description": "After the first. Just after is 12 seconds; with Never, nobody else is revealed.",
      "choices": [ { "value": "same", "label": "Just after" }, { "value": "3", "label": "3 minutes later" }, { "value": "5", "label": "5 minutes later" }, { "value": "10", "label": "10 minutes later" }, { "value": "15", "label": "15 minutes later" }, { "value": "never", "label": "Never" } ] },
    { "key": "reveal3", "label": "Third reveal", "type": "choice", "default": "same",
      "description": "After the second, the same way.",
      "choices": [ { "value": "same", "label": "Just after" }, { "value": "3", "label": "3 minutes later" }, { "value": "5", "label": "5 minutes later" }, { "value": "10", "label": "10 minutes later" }, { "value": "15", "label": "15 minutes later" }, { "value": "never", "label": "Never" } ] },
    { "key": "revealWho", "label": "Reveal", "type": "choice", "default": "phantoms",
      "choices": [ { "value": "phantoms", "label": "Phantoms" }, { "value": "paladins", "label": "Paladins" }, { "value": "both", "label": "Phantoms and paladins" } ] },
    { "key": "revealTo", "label": "Reveal to", "type": "choice", "default": "everyone",
      "choices": [ { "value": "everyone", "label": "Everyone" }, { "value": "phantoms", "label": "Phantoms only" }, { "value": "paladins", "label": "Paladins only" }, { "value": "both", "label": "Phantoms and paladins" } ] },
    { "key": "deathReveal", "label": "Reveal a player's role when they die", "type": "toggle", "default": true,
      "description": "Also shows how many phantoms and innocents are left." }
  ]
}
